{
  "version": "1.0",
  "name": "research-kb-access",
  "description": "Knowledge base access for research analysts with tag filtering.",
  "priority": 15,
  "appliesToAll": false,
  "sourcePatterns": ["kb:research:*", "kb:clinical:*"],
  "permissions": {
    "canQuery": true,
    "readOnly": true
  },
  "objectRules": {
    "tagRules": {
      "allowedTags": ["public", "internal", "research", "clinical-summary"],
      "deniedTags": ["classified", "restricted", "legal-hold", "pii-raw"]
    }
  },
  "limits": {
    "maxResults": 50,
    "minSimilarityScore": 0.75
  }
}
